{
  "accepted": [
    "B"
  ],
  "code": "HSP-C04-QZ-Q2-AM",
  "content_version": "0.3.0-draft",
  "entity_type": "answer-model",
  "id": "9860e586-7469-5ecf-8b26-3587f0aae1e6",
  "prompt_code": "HSP-C04-QZ-Q2",
  "replaced_by": null,
  "replaces": null,
  "scoring_mode": "objective_exact",
  "source_locator": {
    "artifact": "Hospitrainity.docx",
    "block_index": 472,
    "chapter": 4,
    "heading_path": [
      "The Guest-Services Hotline",
      "Step 7. Quiz"
    ],
    "normalized_text_sha256": "88d7b248146c10582b451ce6136194e1991859d6097653a2d36de71aabaee0ae"
  },
  "status": "published"
}
