{
  "accepted": [
    "A"
  ],
  "code": "HSP-C02-QZ-Q2-AM",
  "content_version": "0.3.0-draft",
  "entity_type": "answer-model",
  "id": "8908e1cf-f8ba-5003-a631-b4d8598805b1",
  "prompt_code": "HSP-C02-QZ-Q2",
  "replaced_by": null,
  "replaces": null,
  "scoring_mode": "objective_exact",
  "source_locator": {
    "artifact": "Hospitrainity.docx",
    "block_index": 184,
    "chapter": 2,
    "heading_path": [
      "Front Desk and Check-In",
      "Step 7. Quiz"
    ],
    "normalized_text_sha256": "135371c59e60574284599c446d21e56c111c69eec66f71b2cbe4dc01670a3ffd"
  },
  "status": "published"
}
