{
  "accepted": [
    "b"
  ],
  "code": "HSP-C07-RP-G3-AM",
  "content_version": "0.3.0-draft",
  "entity_type": "answer-model",
  "id": "47c67317-c2e7-534c-a4dc-bbd26924bda3",
  "prompt_code": "HSP-C07-RP-G3",
  "replaced_by": null,
  "replaces": null,
  "scoring_mode": "objective_exact",
  "source_locator": {
    "artifact": "Hospitrainity.docx",
    "block_index": 889,
    "chapter": 7,
    "heading_path": [
      "Dealing with Problems and Complaints",
      "Step 6. Role-play"
    ],
    "normalized_text_sha256": "f804c9afb144d60de72db0ab5800755f23f3a6a9671a363b3abd15376415c9c5"
  },
  "status": "published"
}
