{
  "accepted": [
    "(b). Even under pressure, a warm welcome costs nothing and means a lot."
  ],
  "code": "HSP-C04-PR-I2-AM",
  "content_version": "0.3.0-draft",
  "entity_type": "answer-model",
  "id": "de8cae8e-449d-59ad-b7d4-63d7bd51bdbd",
  "prompt_code": "HSP-C04-PR-I2",
  "replaced_by": null,
  "replaces": null,
  "scoring_mode": "objective_normalized",
  "source_locator": {
    "artifact": "Hospitrainity.docx",
    "block_index": 436,
    "chapter": 4,
    "heading_path": [
      "The Guest-Services Hotline",
      "Step 5. Practice"
    ],
    "normalized_text_sha256": "10ac5076afcc1c6bf43ac37552a0be7c33e21d2c2efb9a5394458d8dbafea018"
  },
  "status": "published"
}
