{
  "accepted": [
    "A"
  ],
  "code": "HSP-C07-QZ-Q4-AM",
  "content_version": "0.3.0-draft",
  "entity_type": "answer-model",
  "id": "93068524-cc49-57a8-8306-c1ad970a2755",
  "prompt_code": "HSP-C07-QZ-Q4",
  "replaced_by": null,
  "replaces": null,
  "scoring_mode": "objective_exact",
  "source_locator": {
    "artifact": "Hospitrainity.docx",
    "block_index": 911,
    "chapter": 7,
    "heading_path": [
      "Dealing with Problems and Complaints",
      "Step 7. Quiz"
    ],
    "normalized_text_sha256": "34f0e894a26f837f04403d0abca34c2e3dc70d4a2d06559f4c4a46919e1067ae"
  },
  "status": "published"
}
