{
  "code": "HSP-C06-CC-SELF-AM",
  "content_version": "0.3.0-draft",
  "entity_type": "answer-model",
  "id": "4cd5f5c3-b21a-5d8e-9480-caaad31e2bbb",
  "prompt_code": "HSP-C06-CC-SELF",
  "replaced_by": null,
  "replaces": null,
  "scoring_mode": "self_report",
  "source_locator": {
    "artifact": "Hospitrainity.docx",
    "block_index": 780,
    "chapter": 6,
    "heading_path": [
      "Online and Social Media Customer Service",
      "Step 8. Confidence check"
    ],
    "normalized_text_sha256": "8ae726d271eb7a0bf90a65a1207e47b0e727c521ff95159d8c7f245ec46d05b7"
  },
  "status": "published"
}
